{
 "arm": "cs",
 "grammar": {
  "citation": "John Huehnergard, “Proto-Semitic,” in The Semitic Languages, 2nd edition, edited by John Huehnergard and Na’ama Pat-El (Routledge, 2019), pp. 49–79; John Huehnergard, “Features of Central Semitic,” in Biblical and Oriental Essays in Memory of William L. Moran, edited by Agustinus Gianto, Biblica et Orientalia 48 (Pontificio Istituto Biblico, 2005), pp. 155–203; John Huehnergard and Aaron D. Rubin, “Phyla and Waves: Models of Classification of the Semitic Languages,” in The Semitic Languages: An International Handbook (De Gruyter, 2011), pp. 259–278.",
  "file_sha256": "19183346403c311f50248a631b42e648c56539c9de1e4610226daae3aba24744"
 },
 "builder": {
  "model": "gpt-6-astra (OpenAI Codex CLI 0.165.0; reasoning effort high) [recorded after the run, from run_builder.sh]",
  "session_started_utc": "2026-10-29T18:20:04Z",
  "transcript_file": "transcript.jsonl"
 },
 "class_order": {
  "prefix": [
   "p_clitic",
   "p_preposition",
   "p_article",
   "p_person",
   "p_stem"
  ],
  "suffix": [
   "s_stem",
   "s_gender_number",
   "s_case_person",
   "s_mood",
   "s_pronoun",
   "s_enclitic"
  ],
  "basis": []
 },
 "entries": [
  {
   "id": "cs_001",
   "morpheme_id": "cs_pro_1sg_gen",
   "category": "pronominal",
   "side": "suffix",
   "slot": "s_pronoun",
   "form": "-iː",
   "segments": [
    "iː"
   ],
   "function": "1csg gen",
   "source": {
    "unit": "TABLE 3.5 PROTO-SEMITIC ENCLITIC PERSONAL PRONOUNS",
    "section": "§3.1.1, Table 3.5",
    "page": "54"
   },
   "notes": "Also in Huehnergard 2019, 3.1.1 Personal pronouns, §3.1.1, p. 54."
  },
  {
   "id": "cs_002",
   "morpheme_id": "cs_pro_1sg_gen",
   "category": "pronominal",
   "side": "suffix",
   "slot": "s_pronoun",
   "form": "-ja",
   "segments": [
    "j",
    "a"
   ],
   "function": "1csg gen",
   "source": {
    "unit": "TABLE 3.5 PROTO-SEMITIC ENCLITIC PERSONAL PRONOUNS",
    "section": "§3.1.1, Table 3.5",
    "page": "54"
   },
   "notes": "Also in Huehnergard 2019, 3.1.1 Personal pronouns, §3.1.1, p. 54."
  },
  {
   "id": "cs_003",
   "morpheme_id": "cs_pro_1sg_acc",
   "category": "pronominal",
   "side": "suffix",
   "slot": "s_pronoun",
   "form": "-niː",
   "segments": [
    "n",
    "iː"
   ],
   "function": "1csg acc",
   "source": {
    "unit": "TABLE 3.5 PROTO-SEMITIC ENCLITIC PERSONAL PRONOUNS",
    "section": "§3.1.1, Table 3.5",
    "page": "54"
   },
   "notes": "Also in Huehnergard 2019, 3.1.1 Personal pronouns, §3.1.1, p. 54."
  },
  {
   "id": "cs_004",
   "morpheme_id": "cs_pro_1pl_gen",
   "category": "pronominal",
   "side": "suffix",
   "slot": "s_pronoun",
   "form": "-ni",
   "segments": [
    "n",
    "i"
   ],
   "function": "1cpl gen",
   "source": {
    "unit": "TABLE 3.5 PROTO-SEMITIC ENCLITIC PERSONAL PRONOUNS",
    "section": "§3.1.1, Table 3.5",
    "page": "54"
   },
   "notes": "Also in Huehnergard 2019, 3.1.1 Personal pronouns, §3.1.1, p. 54."
  },
  {
   "id": "cs_005",
   "morpheme_id": "cs_pro_1pl_acc",
   "category": "pronominal",
   "side": "suffix",
   "slot": "s_pronoun",
   "form": "-na",
   "segments": [
    "n",
    "a"
   ],
   "function": "1cpl acc",
   "source": {
    "unit": "TABLE 3.5 PROTO-SEMITIC ENCLITIC PERSONAL PRONOUNS",
    "section": "§3.1.1, Table 3.5",
    "page": "54"
   },
   "notes": "Also in Huehnergard 2019, 3.1.1 Personal pronouns, §3.1.1, p. 54."
  },
  {
   "id": "cs_006",
   "morpheme_id": "cs_pro_2msg",
   "category": "pronominal",
   "side": "suffix",
   "slot": "s_pronoun",
   "form": "-ka",
   "segments": [
    "k",
    "a"
   ],
   "function": "2msg gen/acc",
   "source": {
    "unit": "TABLE 3.5 PROTO-SEMITIC ENCLITIC PERSONAL PRONOUNS",
    "section": "§3.1.1, Table 3.5",
    "page": "54"
   },
   "notes": "Also in Huehnergard 2019, 3.1.1 Personal pronouns, §3.1.1, p. 54."
  },
  {
   "id": "cs_007",
   "morpheme_id": "cs_pro_2fsg",
   "category": "pronominal",
   "side": "suffix",
   "slot": "s_pronoun",
   "form": "-ki",
   "segments": [
    "k",
    "i"
   ],
   "function": "2fsg gen/acc",
   "source": {
    "unit": "TABLE 3.5 PROTO-SEMITIC ENCLITIC PERSONAL PRONOUNS",
    "section": "§3.1.1, Table 3.5",
    "page": "54"
   },
   "notes": "Also in Huehnergard 2019, 3.1.1 Personal pronouns, §3.1.1, p. 54."
  },
  {
   "id": "cs_008",
   "morpheme_id": "cs_pro_3msg",
   "category": "pronominal",
   "side": "suffix",
   "slot": "s_pronoun",
   "form": "-su",
   "segments": [
    "s",
    "u"
   ],
   "function": "3msg gen/acc",
   "source": {
    "unit": "TABLE 3.5 PROTO-SEMITIC ENCLITIC PERSONAL PRONOUNS",
    "section": "§3.1.1, Table 3.5",
    "page": "54"
   },
   "notes": "Also in Huehnergard 2019, 3.1.1 Personal pronouns, §3.1.1, p. 54."
  },
  {
   "id": "cs_009",
   "morpheme_id": "cs_pro_3fsg",
   "category": "pronominal",
   "side": "suffix",
   "slot": "s_pronoun",
   "form": "-sa",
   "segments": [
    "s",
    "a"
   ],
   "function": "3fsg gen/acc",
   "source": {
    "unit": "TABLE 3.5 PROTO-SEMITIC ENCLITIC PERSONAL PRONOUNS",
    "section": "§3.1.1, Table 3.5",
    "page": "54"
   },
   "notes": "Also in Huehnergard 2019, 3.1.1 Personal pronouns, §3.1.1, p. 54."
  },
  {
   "id": "cs_010",
   "morpheme_id": "cs_pro_2du",
   "category": "pronominal",
   "side": "suffix",
   "slot": "s_pronoun",
   "form": "-kuma:",
   "segments": [
    "k",
    "u",
    "m",
    "a:"
   ],
   "function": "2cdu gen/acc",
   "source": {
    "unit": "TABLE 3.5 PROTO-SEMITIC ENCLITIC PERSONAL PRONOUNS",
    "section": "§3.1.1, Table 3.5",
    "page": "54"
   },
   "notes": "Also in Huehnergard 2019, 3.1.1 Personal pronouns, §3.1.1, p. 54."
  },
  {
   "id": "cs_011",
   "morpheme_id": "cs_pro_2du",
   "category": "pronominal",
   "side": "suffix",
   "slot": "s_pronoun",
   "form": "-kumaj",
   "segments": [
    "k",
    "u",
    "m",
    "a",
    "j"
   ],
   "function": "2cdu gen/acc",
   "source": {
    "unit": "TABLE 3.5 PROTO-SEMITIC ENCLITIC PERSONAL PRONOUNS",
    "section": "§3.1.1, Table 3.5",
    "page": "54"
   },
   "notes": "Also in Huehnergard 2019, 3.1.1 Personal pronouns, §3.1.1, p. 54."
  },
  {
   "id": "cs_012",
   "morpheme_id": "cs_pro_3du",
   "category": "pronominal",
   "side": "suffix",
   "slot": "s_pronoun",
   "form": "-sumaː",
   "segments": [
    "s",
    "u",
    "m",
    "aː"
   ],
   "function": "3cdu gen/acc",
   "source": {
    "unit": "TABLE 3.5 PROTO-SEMITIC ENCLITIC PERSONAL PRONOUNS",
    "section": "§3.1.1, Table 3.5",
    "page": "54"
   },
   "notes": "Also in Huehnergard 2019, 3.1.1 Personal pronouns, §3.1.1, p. 54."
  },
  {
   "id": "cs_013",
   "morpheme_id": "cs_pro_3du",
   "category": "pronominal",
   "side": "suffix",
   "slot": "s_pronoun",
   "form": "-sumaj",
   "segments": [
    "s",
    "u",
    "m",
    "a",
    "j"
   ],
   "function": "3cdu gen/acc",
   "source": {
    "unit": "TABLE 3.5 PROTO-SEMITIC ENCLITIC PERSONAL PRONOUNS",
    "section": "§3.1.1, Table 3.5",
    "page": "54"
   },
   "notes": "Also in Huehnergard 2019, 3.1.1 Personal pronouns, §3.1.1, p. 54."
  },
  {
   "id": "cs_014",
   "morpheme_id": "cs_pro_2mpl",
   "category": "pronominal",
   "side": "suffix",
   "slot": "s_pronoun",
   "form": "-kum(±uː)",
   "segments": [
    "k",
    "u",
    "m"
   ],
   "function": "2mpl gen/acc",
   "source": {
    "unit": "TABLE 3.5 PROTO-SEMITIC ENCLITIC PERSONAL PRONOUNS",
    "section": "§3.1.1, Table 3.5",
    "page": "54"
   },
   "notes": "Also in Huehnergard 2019, 3.1.1 Personal pronouns, §3.1.1, p. 54."
  },
  {
   "id": "cs_015",
   "morpheme_id": "cs_pro_2mpl",
   "category": "pronominal",
   "side": "suffix",
   "slot": "s_pronoun",
   "form": "-kum(±uː)",
   "segments": [
    "k",
    "u",
    "m",
    "uː"
   ],
   "function": "2mpl gen/acc",
   "source": {
    "unit": "TABLE 3.5 PROTO-SEMITIC ENCLITIC PERSONAL PRONOUNS",
    "section": "§3.1.1, Table 3.5",
    "page": "54"
   },
   "notes": "Also in Huehnergard 2019, 3.1.1 Personal pronouns, §3.1.1, p. 54."
  },
  {
   "id": "cs_016",
   "morpheme_id": "cs_pro_2fpl",
   "category": "pronominal",
   "side": "suffix",
   "slot": "s_pronoun",
   "form": "-kin(±aː)",
   "segments": [
    "k",
    "i",
    "n"
   ],
   "function": "2fpl gen/acc",
   "source": {
    "unit": "TABLE 3.5 PROTO-SEMITIC ENCLITIC PERSONAL PRONOUNS",
    "section": "§3.1.1, Table 3.5",
    "page": "54"
   },
   "notes": "Also in Huehnergard 2019, 3.1.1 Personal pronouns, §3.1.1, p. 54."
  },
  {
   "id": "cs_017",
   "morpheme_id": "cs_pro_2fpl",
   "category": "pronominal",
   "side": "suffix",
   "slot": "s_pronoun",
   "form": "-kin(±aː)",
   "segments": [
    "k",
    "i",
    "n",
    "aː"
   ],
   "function": "2fpl gen/acc",
   "source": {
    "unit": "TABLE 3.5 PROTO-SEMITIC ENCLITIC PERSONAL PRONOUNS",
    "section": "§3.1.1, Table 3.5",
    "page": "54"
   },
   "notes": "Also in Huehnergard 2019, 3.1.1 Personal pronouns, §3.1.1, p. 54."
  },
  {
   "id": "cs_018",
   "morpheme_id": "cs_pro_3mpl",
   "category": "pronominal",
   "side": "suffix",
   "slot": "s_pronoun",
   "form": "-sum(±uː)",
   "segments": [
    "s",
    "u",
    "m"
   ],
   "function": "3mpl gen/acc",
   "source": {
    "unit": "TABLE 3.5 PROTO-SEMITIC ENCLITIC PERSONAL PRONOUNS",
    "section": "§3.1.1, Table 3.5",
    "page": "54"
   },
   "notes": "Also in Huehnergard 2019, 3.1.1 Personal pronouns, §3.1.1, p. 54."
  },
  {
   "id": "cs_019",
   "morpheme_id": "cs_pro_3mpl",
   "category": "pronominal",
   "side": "suffix",
   "slot": "s_pronoun",
   "form": "-sum(±uː)",
   "segments": [
    "s",
    "u",
    "m",
    "uː"
   ],
   "function": "3mpl gen/acc",
   "source": {
    "unit": "TABLE 3.5 PROTO-SEMITIC ENCLITIC PERSONAL PRONOUNS",
    "section": "§3.1.1, Table 3.5",
    "page": "54"
   },
   "notes": "Also in Huehnergard 2019, 3.1.1 Personal pronouns, §3.1.1, p. 54."
  },
  {
   "id": "cs_020",
   "morpheme_id": "cs_pro_3fpl",
   "category": "pronominal",
   "side": "suffix",
   "slot": "s_pronoun",
   "form": "-sin(±aː)",